{
  "manifest_version": 1,
  "agent_name": "claims-triage",
  "agent_version": "0.1.0",
  "language": "python",
  "runtime_version": "3.10.14",
  "sdk_version": "0.1.0",
  "container_digest": "sha256:4444444444444444444444444444444444444444444444444444444444444444",
  "dependency_hashes": {
    "requirements.txt": "sha256:5555555555555555555555555555555555555555555555555555555555555555"
  },
  "prompt_template_hashes": {
    "claim_classification": "sha256:6666666666666666666666666666666666666666666666666666666666666666"
  },
  "tool_definitions": [
    {
      "name": "crm.upsert_account",
      "version": "1.0.0",
      "schema_hash": "sha256:7777777777777777777777777777777777777777777777777777777777777777"
    }
  ],
  "model_configuration": {
    "provider": "Example Model",
    "model": "example-large",
    "configuration_hash": "sha256:8888888888888888888888888888888888888888888888888888888888888888"
  },
  "policy_hash": "sha256:9999999999999999999999999999999999999999999999999999999999999999",
  "policy_version": 1,
  "network_destinations": [
    {
      "id": "model_provider",
      "type": "model_provider",
      "domain": "api.model.example",
      "risk": "medium"
    },
    {
      "id": "crm",
      "type": "external_tool",
      "domain": "api.crm.example",
      "risk": "high"
    }
  ],
  "required_secrets": [
    "MODEL_PROVIDER_API_KEY",
    "CRM_API_KEY"
  ],
  "usage_meters": [
    {
      "name": "claim_count",
      "unit": "claim"
    },
    {
      "name": "model_tokens",
      "unit": "token"
    }
  ],
  "signature": {
    "algorithm": "ed25519",
    "key_id": "dev-key-001",
    "value": "sig_test_value"
  }
}
